name,id,tier,rarity,tech/manufacturer,tags,uiTags,base value,unlocked,hidden,hiddenEverywhere,cost_frigate,cost_dest,cost_cruiser,cost_capital,script,desc,short,sModDesc,sprite
#Makeshift Phase Coils,makeshiftphase,3,,,"no_drop, no_drop_salvage, phase, standard",Phase,7000,,,,5,10,15,25,data.hullmods.MakeshiftPhase,"Replace the ship's system with an inefficient phase system that does not require external phase coils.

Unlike regular phase systems that use base flux, it has an upkeep of %s of maximum flux per second. Can cause overloads.",Installs basic phase capability on non-phase ship.,,graphics/hullmods/phase_coil_instability.png
Ablative Armor,ablative_armor,,,,"no_drop, no_drop_salvage",Defenses,,,,,0,0,0,0,data.hullmods.AblativeArmorAlt,"An ancient design intended to stop micro-meteorites through sheer volume of material in place, before the advent of ""spaced"" armor.

Reduces the effective armor strength for the damage reduction calculation to %s of its actual value. However, ships of this design tend to carry extremely heavy armor.",Reduces damage reduction by armor.,Outfit the ship's canister flak system to an experimental damper field.,graphics/hullmods/ablative_armor.png
Adaptive Phase Coils,adaptive_coils,2,,,"phase, merc, standard",Phase,5000,,,,5,10,15,25,data.hullmods.AdaptivePhaseCoilsAlt,"Phase coils are less able to maintain a connection with normal space as the ship's hard flux levels rise, resulting in a greatly reduced top speed as the coils struggle to gain traction.

This modification allows the coils to handle higher levels of hard flux, increasing the threshold at which speed bottoms out by %s. For standard-design coils with no other modifications, this takes the threshold from %s to %s.",Reduces impact of hard flux level on top speed while phased.,,graphics/hullmods/phase_field.png
Advanced Targeting Core,advancedcore,,,,"no_drop, no_drop_salvage",Weapons,,,,,70,70,70,70,data.hullmods.AdvancedTargetingCore,"Extends the range of ballistic and energy weapons by %s. The range of point-defense weapons is only extended by %s.

Precludes the installation of a Dedicated Targeting Core or an Integrated Targeting Unit.",Greatly extends non-missile weapon range.,"Certain protocols are disabled in favor of mobility, similar to safety overrides. 

However, this reduces the range bonus of ballistic and energy weapons to %s. The range of point-defense weapons is unaffected.",graphics/hullmods/advanced_targeting_core.png
Armored Weapon Mounts,armoredweapons,0,,,"defensive, merc, standard","Weapons, Defenses",2500,TRUE,,,3,6,9,15,data.hullmods.ArmoredWeapons,"Increases the durability of all weapons by %s and reduces recoil by %s, but decreases weapon turn rate by %s. Also increases the ship's armor by %s.","Makes weapons harder to disable, reduces recoil.","Increases the rate of fire of all non-missile weapons by %s.

Decreases flux generated by all non-missile weapons by %s.",graphics/hullmods/armored_weapon_emplacements.png
Assault Package,assault_package,1,,,"req_spaceport, weapons, engines, civ_package, standard","Special, Engines, Weapons, Logistics, Requires Dock",8000,,,,5,10,15,25,data.hullmods.AssaultPackageAlt,"Weapon fire controls are disabled, increasing rate of fire of all ballistic, energy, and missile weapons by %s. However, the recoil is increased by %s.

All unnecessary thrusters are redirected, increasing top speed and zero flux boost speed by %s. The ship can no longer decelerate.","Increases hull integrity, armor, and flux capacity.",,graphics/hullmods/assault_package.png
Augmented Drive Field,augmentedengines,1,,,"req_spaceport, merc, standard","Logistics, Requires Dock",8000,,,,4,8,12,20,data.hullmods.AugmentedEngines,Increases maximum burn level by %s.,Increases maximum burn level.,Increases maximum burn level by a further %s.,graphics/hullmods/augmented_drive_field2.png
Auxiliary Thrusters,auxiliarythrusters,1,,,"engines, merc, standard",Engines,5000,TRUE,,,5,10,15,25,data.hullmods.AuxiliaryThrusters,Increases the ship's maneuverability by %s.,Increases maneuverability.,"No longer affects acceleration and deceleration.

Turn rate increased by %s.",graphics/hullmods/auxilliary_thrusters.png
B-Deck,bdeck,1,,,"special, merc, standard",Fighters,4000,,,,5,10,15,25,data.hullmods.BDeckAlt,"Once per combat, when the fighter replacement rate reaches %s, the fighter launch bays are switched over to operate from a ""B-Deck"".

Standby fighters are launched to rapidly bring the wings back up to full strength, and the fighter replacement rate is set to %s.",Launches fresh wing once per combat and replenishes the replacement rate.,,graphics/hullmods/bdeck.png
Blast Doors,blast_doors,0,,,"defensive, merc, standard",Defenses,2500,TRUE,,,3,5,8,12,data.hullmods.BlastDoors,"Installs additional hermetic and heavily reinforced doors at critical junctures throughout the ship. Increases hull integrity by %s.

Ship takes %s fewer crew casualties from hull damage sustained in combat.","Increases hull integrity, reduces crew casualties.",Increases the crew casualty reduction to %s.,graphics/hullmods/blast_doors.png
Civilian-grade Hull,civgrade,,,,"no_drop, no_drop_salvage","Special, Requires Dock",6000,,,,2,4,6,10,data.hullmods.CivGrade,Increases sensor profile by %s. Reduces sensor strength by %s.,"Increases sensor profile, reduces sensor strength.",Negates the sensor profile and sensor strength penalty.,graphics/hullmods/civilian_grade.png
Converted Cargo Bay,converted_bay,1,,,"no_drop, no_drop_salvage",,,,,,15,30,45,70,data.hullmods.ConvertedCargoBay,"This ship's cargo hold has been converted to house a pair of fighter bays. The improvised manufactory that produces fighter chassis is unreliable, and most components have minor defects. Fighter speed reduced by %s, and damage taken increased by %s.",Pair of improvised fighter bays.,"Push the flight deck to its limits.

Fighter replacement rate can no longer recover.",graphics/hullmods/converted_hangar.png
Converted Fighter Bay,converted_fighterbay,0,,,"req_spaceport, special, non_phase, standard","Fighters, Logistics, Requires Dock",3000,,,,3,6,9,15,data.hullmods.ConvertedFighterBay,"Converts the ship's fighter bays into improvised cargo holds, giving it an additional %s cargo capacity and reducing its crew requirements by %s per fighter bay. The crew reduction is limited to a maximum of %s.

Decreases the ship's deployment points and supply cost to recover from deployment by %s/%s/%s/%s per fighter bay.",Converts fighter bays into improvised cargo holds.,"Monthly maintenance cost reduced by %s per fighter bay.

Increases hull integrity by %s per fighter bay.",graphics/hullmods/converted_fighter_bay.png
Converted Hangar,converted_hangar,1,,,"special, merc, standard",Fighters,5000,,,,10,10,12,20,data.hullmods.ConvertedHangarAlt,<Tooltip created in script>,Improvised fighter bay for non-carriers.,"Increases the rate at which the fighter replacement rate recovers by %s for cruisers, and by %s for capital ships. No added effect for frigates and destroyers.",graphics/hullmods/converted_hangar.png
Dedicated Targeting Core,dedicated_targeting_core,0,,,"offensive, merc, standard",Weapons,2500,TRUE,,,0,0,9,15,data.hullmods.DedicatedTargetingCore,"Increases the range of ballistic and energy weapons by %s/%s for cruisers/capital ships.

Can not be installed on a frigate or a destroyer, and can not work in conjunction with Integrated Targeting Unit.

Most combat ships install either an Integrated Targeting Unit or a Dedicated Targeting Core, with the exception of more specialized variants.","Increases weapon range, more so for larger ships.",Increases the range bonus to %s for cruisers and %s for capital ships.,graphics/hullmods/targeting_core.png
Defensive Targeting Array,defensive_targeting_array,2,,,"special, merc, standard",Fighters,3000,,,,2,4,6,10,data.hullmods.DefensiveTargetingArrayAlt,"Standard fighter communication links are re-purposed to provide short-range targeting data.

Increases fighter damage to missiles and other fighters by %s, and damage against ships by %s.

Makes the fighters unable to leave the vicinity of their ship.","Increases fighter damage, reduces fighter roam range to zero.","Extends range of ballistic, energy, and missile weapons of the ship's fighters by %s units.",graphics/hullmods/defensive_targeting_array.png
Delicate Machinery,delicate,1,,,"no_drop, no_drop_salvage",,,,,,5,10,15,25,data.hullmods.DelicateMachinery,"The ship systems require excessive maintenance and do not stand up well under the rigours of prolonged engagements.

Increases the rate of in-combat CR decay after peak performance time runs out by %s.",Increases CR decay rate after peak time runs out.,Change ship system.,graphics/hullmods/delicate_machinery.png
Distributed Fire Control,distributed_fire_control,,,,,,,,TRUE,,0,0,0,0,data.hullmods.DistributedFireControlAlt,"Much of the damage that takes weapons offline is to external control runs and power conduits. This ship's weapons are engineered to operate more independently, reducing their exposure to damage by %s and reducing the EMP damage taken by the ship overall by %s.

These effects are disabled if an Integrated Targeting Unit or a Dedicated Targeting Core in installed.",Increases weapon durability and reduces EMP damage taken.,,graphics/hullmods/distributed_fire_control2.png
Drive Field Stabilizer,drive_field_stabilizer,,,,"no_drop, no_drop_salvage",Logistics,,,,,0,0,0,0,data.hullmods.DriveFieldStabilizerAlt,"Stabilizes the fleet's drive bubble, increasing the maximum burn of the fleet by %s. The effect of multiple stabilizers is cumulative.

Increases the ship's sensor profile by %s.",Increase fleetwide burn level.,"Stabilizes the fleet's drive bubble, increasing the maximum burn of the fleet by %s. The effect of multiple stabilizers is cumulative.

Increases the ship's sensor profile by %s.",graphics/hullmods/augmented_drive_field.png
ECM Package,ecm,2,,,"offensive, special, merc, standard","Weapons, Support, Special",4000,,,,4,8,12,20,data.hullmods.ECMPackageAlt,"When deployed in combat, grants %s/%s/%s/%s ECM rating, depending on this ship's hull size.

Increases system range by %s.",Increases ship's ECM rating. Improves system.,"Increases system regeneration rate by %s.

Decreases system cooldown by %s.",graphics/hullmods/ecm_package.png
Energy Bolt Coherer,coherer,3,,,"offensive, merc",Weapons,10000,,,,5,10,15,25,data.hullmods.EnergyBoltCohererAlt,<tooltip created in the script>,Increases base range of non-beam energy weapons.,,graphics/hullmods/coherer.png
Escort Package,escort_package,1,,,"req_spaceport, defensive, engines, civ_package, standard","Special, Defenses, Engines, Logistics, Requires Dock",8000,,,,5,10,15,25,data.hullmods.EscortPackageAlt,"Increases the ship's maneuverability by %s. Increases the range of all point-defense weapons by %s, and increases the damage dealt to fighters and missiles by %s.

These effects are also applied to fighters launched by this ship.","Increases maneuverability, point-defense range, and damage dealt to fighters and missiles.",,graphics/hullmods/escort_package.png
Expanded Deck Crew,expanded_deck_crew,1,,,"special, merc, standard",Fighters,4000,,,,5,10,15,25,data.hullmods.ExpandedDeckCrewAlt,"Reduces the rate at which the fighter replacement rate decreases due to fighter losses by %s, and increases the rate at which it recovers by %s. Time to launch replacement fighters is decreased by %s.

Increases the crew required by %s per fighter bay.","Improves fighter replacement rate, increases crew requirements.",,graphics/hullmods/expanded_deck_crew.png
Experimental Phase Coils,ex_phase_coils,,,,"no_drop, no_drop_salvage, phase, no_build_in",Phase,5000,,,,10,20,30,50,data.hullmods.ExperimentalPhaseCoilsAlt,Reduces phase cloak cooldown by %s.,Greatly reduces phase cloak cooldown.,,graphics/hullmods/phase_coils_experimental.png
Flux Shunt,fluxshunt,,,,"no_drop, no_drop_salvage",Special,10000,,,,15,30,45,70,data.hullmods.FluxShunt,Allows the ship to dissipate hard flux at %s of the normal rate while shields are on.,Allows dissipation of hard flux while shields are up.,"Bonus decreased to %s of the normal rate while shields are on instead.

The shunt is diverted to the weapon mounts. Weapons no longer generate flux.",graphics/hullmods/flux_shunt.png
Fourteenth Battlegroup,fourteenth,,,,"no_drop, no_drop_salvage",Special,10000,,,,5,10,15,25,data.hullmods.Fourteenth,"This ship is a survivor of the original 14th Domain Battlegroup which founded the Hegemony. It is a prime specimen of the Domain Navy's ""decisive battle"" doctrine, particularly exhibited by a series of radical structural modifications (performed with pre-Collapse industrial methods) which allow the mounting of heavier armor plating by a flat increase of %s standard units, with only a %s reduction in speed and maneuverability. Exceptionally well-tuned energy systems increase flux throughput and capacity by %s over standard examples of this hull.",,"The heavier armor plating is completely removed. Negates the armor bonus and reduces it by %s. 

Increases speed and maneuverability by %s instead of decreasing it. Flux throughput and capacity remains the same.",graphics/hullmods/fourteenth.png
HBI Refund 1,hbi_refund_1,,,,,,,,TRUE,TRUE,-10,-10,-10,-10,com.fs.starfarer.api.combat.BaseHullMod,Scuffed method used for HBI smod refund,,,
HBI Refund 10,hbi_refund_10,,,,,,,,TRUE,TRUE,-100,-100,-100,-100,com.fs.starfarer.api.combat.BaseHullMod,Scuffed method used for HBI smod refund,,,
HBI Refund 11,hbi_refund_11,,,,,,,,TRUE,TRUE,-110,-110,-110,-110,com.fs.starfarer.api.combat.BaseHullMod,Scuffed method used for HBI smod refund,,,
HBI Refund 12,hbi_refund_12,,,,,,,,TRUE,TRUE,-120,-120,-120,-120,com.fs.starfarer.api.combat.BaseHullMod,Scuffed method used for HBI smod refund,,,
HBI Refund 13,hbi_refund_13,,,,,,,,TRUE,TRUE,-130,-130,-130,-130,com.fs.starfarer.api.combat.BaseHullMod,Scuffed method used for HBI smod refund,,,
HBI Refund 14,hbi_refund_14,,,,,,,,TRUE,TRUE,-140,-140,-140,-140,com.fs.starfarer.api.combat.BaseHullMod,"Scuffed method used for HBI smod refund

Oh god I really hope Sepulcher is the largest amount of large ballistic mounts.",,,
HBI Refund 2,hbi_refund_2,,,,,,,,TRUE,TRUE,-20,-20,-20,-20,com.fs.starfarer.api.combat.BaseHullMod,Scuffed method used for HBI smod refund,,,
HBI Refund 3,hbi_refund_3,,,,,,,,TRUE,TRUE,-30,-30,-30,-30,com.fs.starfarer.api.combat.BaseHullMod,Scuffed method used for HBI smod refund,,,
HBI Refund 4,hbi_refund_4,,,,,,,,TRUE,TRUE,-40,-40,-40,-40,com.fs.starfarer.api.combat.BaseHullMod,Scuffed method used for HBI smod refund,,,
HBI Refund 5,hbi_refund_5,,,,,,,,TRUE,TRUE,-50,-50,-50,-50,com.fs.starfarer.api.combat.BaseHullMod,Scuffed method used for HBI smod refund,,,
HBI Refund 6,hbi_refund_6,,,,,,,,TRUE,TRUE,-60,-60,-60,-60,com.fs.starfarer.api.combat.BaseHullMod,Scuffed method used for HBI smod refund,,,
HBI Refund 7,hbi_refund_7,,,,,,,,TRUE,TRUE,-70,-70,-70,-70,com.fs.starfarer.api.combat.BaseHullMod,Scuffed method used for HBI smod refund,,,
HBI Refund 8,hbi_refund_8,,,,,,,,TRUE,TRUE,-80,-80,-80,-80,com.fs.starfarer.api.combat.BaseHullMod,Scuffed method used for HBI smod refund,,,
HBI Refund 9,hbi_refund_9,,,,,,,,TRUE,TRUE,-90,-90,-90,-90,com.fs.starfarer.api.combat.BaseHullMod,Scuffed method used for HBI smod refund,,,
Heavy Ballistics Integration,hbi,,,,"no_drop, no_drop_salvage",Weapons,8000,,,,5,10,15,25,data.hullmods.HeavyBallisticsIntegrationAlt,Reduces the ordnance point cost of large ballistic weapons by %s.,Reduces ordnance point cost of large ballistic weapons.,"Negates the ordnance point cost reduction of all large ballistic weapons.

Change all large ballistic weapon slots into hybrid slots and increases weapon arc by %s.

Select a different ship and come back to see the effect.",graphics/hullmods/ballistics_integration.png
High Scatter Amplifier,high_scatter_amp,3,,,"offensive, merc, standard",Weapons,5000,,,,4,8,12,20,data.hullmods.HighScatterAmpAlt,<tooltip created in the script due to sections>,Reduces beam range; beams deal more damage and apply hard flux to shields.,Increases beam weapon damage by an additional %s.,graphics/hullmods/high_scatter_amp.png
High Volition Attractor,high_frequency_attractor,,,,"no_drop, no_drop_salvage, phase, no_build_in","Special, Phase",50000,,,,15,30,45,70,data.hullmods.HighVolitionAttractor,"An experimental modification allowing high-frequency motes to be warped in by the rift core on board the ship.

This modification is barely kept stable. If the hull is damaged, all crew aboard dies.",Launches more powerful high-frequency motes.,,graphics/hullmods/high_volition_attractor.png
Ill-Advised Modifications,ill_advised,3,,,dmod,Special,10000,,,,2,4,6,10,data.hullmods.IllAdvised,"This hull's systems have been drastically modified from spec, likely without certified engineering oversight. Its systems appear to work correctly under routine conditions, but have a significant chance of critical malfunction when stressed.

During combat, weapons and engines have a %s/%s chance to malfunction. All malfunctions have a %s chance of being critical after peak performance time runs out.

Activates the positive S-mod effect of other hullmods. Does not affect Logistics hullmods.",,,graphics/hullmods/illadvised.png
Integrated Point Defense AI,pointdefenseai,3,,,"defensive, merc, standard","Weapons, Defenses",10000,,,,3,6,9,15,data.hullmods.IntegratedPointDefenseAI,"Gives all point-defense weapons the ability to identify - and ignore - decoy flares. In addition, all point-defense weapons get the best possible target leading, regardless of combat readiness, and all damage to missiles is increased by %s. 

Additionally, all small non-missile weapons are classified as ""point-defense"", automatically target missiles, and are affected by point-defense stat modifiers.",Small non-missile weapons act as point-defense; PD not affected by decoy flares.,"All small, medium and large non-missile weapons are classified as ""point-defense"", automatically target missiles, and are affected by point-defense stat modifiers.",graphics/hullmods/integrated_point_defense_ai.png
Integration Suite,integrationsuite,,,,"no_drop, no_drop_salvage, standard","Special, Logistics, Requires Dock",2500,,TRUE,,5,10,15,25,data.hullmods.IntegrationSuite,"Extremely talented captains are said to be able to utilize the full potential of hull modifications, even building them in at no cost.

This hull modification mimics that effect. Activates the positive S-mod effect of other hullmods.

Does not affect logistics hullmods. Does not affect Logistics hullmods.",Activates S-mod effects of other hullmods.,,graphics/hullmods/damper_field.png
Makeshift Shield Generator,frontshield,0,,,"shields, defensive, standard",Shields,4000,,,,5,10,15,25,data.hullmods.FrontShieldGenerator,"Installs an inefficient shield generator that does not require external emitter nodes. The shield emitter is locked in a forward-facing position and has a %s degree arc.

The shield generator draws much of its power from engines and reduces the ship's top speed by %s.

If the ship already possesses a shield, the top speed penalty is negated. Instead, the external emitter nodes are replaced with reinforced plating, increasing the ship's armor by %s. Ships with omni shields will retain their ability use omni-directional shielding, at an arc penalty.",Installs basic shields on shieldless ship. Replaces existing shields if present. Reduces top speed.,,graphics/hullmods/front_shield_generator.png
Nav Relay,nav_relay,2,,,"engines, special, merc, standard","Engines, Support, Fighters",5000,,,,4,8,12,20,data.hullmods.NavRelayAlt,"When deployed in combat, increases nav rating of your fleet by %s/%s/%s/%s, depending on this ship's hull size.

The total nav rating of your fleet increases the top speed of your deployed ships.

Increases fighter's top speed launched from this ship by %s.",Increases top speed of deployed ships and fighters from this ship.,Increases fighter engagement range by %s.,graphics/hullmods/nav_relay.png
Neural Integrator,neural_integrator,,,,"special, no_drop, no_drop_salvage",Special,10000,,,,4,8,12,20,com.fs.starfarer.api.impl.hullmods.NeuralIntegrator,"An augmented version of Neural Interface that works with automated ships by enabling direct control of all of the ship's systems via the link, instead of having the controlling conscousness aspect simply direct the bridge crew.

Links the flagship with another ship, allowing switching between ships without using a shuttle pod. Both ships must have a Neural Interface and not be commanded by an officer or an AI core. The transfer is instant if the combined deployment points of the ships are %s or less.

If the linked ship is destroyed or leaves the battlefield, the flagship will establish a neural link with another ship with a Neural Interface. If the flagship is destroyed or leaves the battlefield, command will have to be physically transferred to another ship with a Neural Interface before a new link can be established.

Both linked ships benefit from your personal combat skills as if you'd transferred command to them, regardless of which one you're controlling personally. As with ""transfer command"", some skill effects - such as those increasing ammo capacity, or other fixed ship stats - do not apply.",Specialized Neural Interface for automated ships.,,graphics/hullmods/neural_integrator.png
Neural Interface,neural_interface,3,,,"special, no_drop, no_drop_salvage",Special,10000,,,,3,6,9,15,com.fs.starfarer.api.impl.hullmods.NeuralInterface,"Links the flagship with another ship, allowing switching between ships without using a shuttle pod. Both ships must have a Neural Interface and not be commanded by an officer or an AI core. The transfer is instant if the combined deployment points of the ships are %s or less.

If the linked ship is destroyed or leaves the battlefield, the flagship will establish a neural link with another ship with a Neural Interface. If the flagship is destroyed or leaves the battlefield, command will have to be physically transferred to another ship with a Neural Interface before a new link can be established.

Both linked ships benefit from your personal combat skills as if you'd transferred command to them, regardless of which one you're controlling personally. As with ""transfer command"", some skill effects - such as those increasing ammo capacity, or other fixed ship stats - do not apply.","Allows rapid switching between ships, resets system cooldown and adds a charge.",,graphics/hullmods/neural_interface.png
Phase Anchor,phase_anchor,3,,,"phase, merc, no_build_in, standard, phase_brawler",Phase,7000,,,,10,20,30,50,data.hullmods.PhaseAnchorAlt,"Reduces the phase cloak's activation cost to %s. Increases the soft flux dissipation and weapon recharge rate by %s while phased.

When suffering critical damage that would otherwise destroy or disable the ship, able to initiate an emergency dive deep into p-space. The ship counts as retreated and will emerge into normal space when combat is over, suffering an additional penalty to combat readiness equal to %s its deployment cost. The ship must have enough combat readiness to cover this cost to initiate the dive.

Due to the immense distortions in p-space caused by such a maneuver, only one ship per battle - regardless of which side it's on - is able to perform it.","Increases flux dissipation and weapon recharge while phased, emergency dive maneuver.",,graphics/hullmods/phase_anchor.png
Phase Field,phasefield,,,,,,,,TRUE,,0,0,0,0,data.hullmods.PhaseFieldAlt,"The ship is able to run a low-grade phase field for extended periods of time, reducing its effective sensor profile by %s.",Reduces fleetwide sensor profile.,,graphics/hullmods/phase_field.png
Recovery Shuttles,recovery_shuttles,1,,,"special, standard",Fighters,4000,,,,3,6,9,15,data.hullmods.RecoveryShuttlesAlt,Reduces the casualties suffered by fighter pilots by %s. Reduces the rate at which the fighter replacement rate decreases due to fighter losses by %s.,Reduces fighter pilot casualties.,Increases the fighter pilot casualty reduction to %s.,graphics/hullmods/recovery_shuttles.png
Reinforced Bulkheads,reinforcedhull,0,,,"defensive, merc, standard",Defenses,2500,TRUE,,,5,10,15,25,data.hullmods.ReinforcedBulkheads,"Increases the ship's hull integrity by %s. If disabled, the ship will not break apart and is almost always recoverable after the battle.",Increases hull integrity; ship almost always recoverable if lost.,Further increase the ship's hull integrity by %s per D-mod.,graphics/hullmods/reinforced_bulkheads.png
Rugged Construction,rugged,2,,,"no_drop, no_drop_salvage","Special, Defenses, Requires Dock",3000,,,,3,6,9,15,data.hullmods.RuggedConstructionAlt,"Reduces most negative effects of d-mods by %s. If disabled or destroyed in combat, the ship has a %s chance to avoid new d-mods, and is almost always recoverable after the battle.

In addition, the supply cost to recover from deployment - and to effect repairs if the ship is disabled - is reduced by %s.",Reduces impact of d-mods; ship almost always recoverable if lost.,"Negative effects of d-mods are only reduced by %s.

Each d-mod increases the armor by %s, and hull integrity by %s.",graphics/hullmods/rugged_construction.png
