name,id,tier,rarity,tech/manufacturer,tags,uiTags,base value,unlocked,hidden,hiddenEverywhere,cost_frigate,cost_dest,cost_cruiser,cost_capital,script,desc,short,sModDesc,sprite
Safety Overrides,safetyoverrides,0,,,"special, engines, offensive, merc, standard","Special, Engines",2500,TRUE,,,15,30,45,70,data.hullmods.SafetyOverrides,"Disabling safety protocols increases the ship's top speed in combat by %s/%s/%s/%s (depending on ship size, with a corresponding increase in acceleration) and allows the zero-flux engine boost to take effect regardless of flux level. The flux dissipation rate, including that of additional vents, is increased by a factor of %s.

Reduces the peak performance time by a factor of %s, prevents the use of active venting, and drastically reduces weapon ranges past %s units.","Drastic improvement in performance, much lower peak time.","This hull's systems have been drastically modified from spec, likely without certified engineering oversight. Its systems appear to work correctly under routine conditions, but have a significant chance of critical malfunction when stressed.",graphics/hullmods/safety_overrides.png
Shield Conversion - Front,frontemitter,2,,,"shields, defensive, merc, standard",Shields,7000,,,,3,5,8,12,data.hullmods.FrontShieldEmitter,"Locks the ship's omni-directional shield emitter to a front-facing position and extends its arc by %s. As with all frontal emitters, the shield will also deploy twice as quickly.","Converts omni shield to front, extends arc.",Extends the shield's arc by %s instead.,graphics/hullmods/front_shield_emitter.png
Shield Shunt,shield_shunt,1,,,"special, engines, offensive, shields, merc, standard","Special, Shields, Engines",3000,,,,3,5,7,10,data.hullmods.ShieldShuntAlt,"Removes the ship's shields. The external emitter nodes are replaced with reinforced plating, increasing the ship's armor by %s. 

The idle power requirement is redirected to the ship's engine, increasing the ship's top speed in combat by %s.

On phase ships, replace phase with a much simpler damper field.","Removes shields, increases armor and improves top speed.","Increases the ship's armor by an additional %s.

Increases the ship's top speed in combat by an additional %s.",graphics/hullmods/shield_shunt.png
Shielded Cargo Holds,shielded_holds,0,,,"req_spaceport, merc, standard","Logistics, Requires Dock",4000,,,,5,10,15,25,data.hullmods.ShieldedCargoHolds,"Commonly found on ships that can't always rely on shields to protect their cargo from cosmic radiation. Only a few tweaks are needed to have the shielding confound long-range cargo scans, reducing the probability of contraband being detected.",Improves chance to avoid detection of contraband.,,graphics/hullmods/shielded_cargo_hold.png
Special Modifications,andrada_mods,3,,,dmod,Special,10000,,,,2,4,6,10,data.hullmods.AndradaModsAlt,"During an inspection of an early prototype, the Supreme Executor was heard to comment unfavorably on exposed conduits running along the passageways, and the danger these must pose to the brave and loyal crew under combat conditions. 

The new chief designer, a loyal officer appointed by the Supreme Executor himself, instructed the forge-programmers to make accommodations for the installation of special blast-proof insulated paneling produced by Sindria itself.

If the passages are a bit narrower, conduits prone to overheating, and flush-set panels somewhat unwieldy to access, the official readiness reports include no criticism of the changes. Everyone agrees in both public and - as the Internal Security Ministry can attest - in private, that the stark grandeur of the Lion's Guard fleet is breathtaking.

Increases combat readiness by %s.

Crew casualties in combat are increased by %s. The base flux dissipation rate is reduced by %s, and the repair rate for disabled weapons and engines is reduced by %s.",Reduces the ship's performance.,,graphics/hullmods/special_modifications.png
Stealth Minefield,stealth_minefield_Doom,,,,,,,,TRUE,,5,10,15,25,data.hullmods.StealthMinefieldDoom,Mines attack the closest enemy ships within %ssu during battle.,Mines attack enemy ships during battle.,,graphics/hullmods/stealth_mines.png
Unstable Injector,unstable_injector,0,,,"engines, merc, standard",Engines,2500,TRUE,,,4,8,12,20,data.hullmods.UnstableInjector,"Increases the ship's top speed and zero-flux boost by %s/%s/%s/%s su/second, depending on hull size.

Has a small chance to cause engine malfunctions, around %s every second.","Increases speed, reduces combat readiness.","Increases the ship's top speed and zero-flux bonus by by a factor of %s.

Ship can no longer decelerate.",graphics/hullmods/unstable_injector.png